vendor_guid,object_type,title,description,display_name,calculation_method,calculation_int,parent_guids,workflow_state,mastery_points,ratings,,,,,,,,,
FerrisPROB4,outcome,PRB4 Critical thinking,"Problem Solving – PRB4 Critical thinking – Students will demonstrate critical thinking in order to identify, interpret, and resolve problems. ",PROB4,highest,,FerrisPROB,active,3,4,"Advanced: Clearly identifies a problem through extensive examination and deliberation, carefully interprets evidence for different viewpoints, and thoroughly articulates a resolution based on evidence",3,"Proficient: Clearly identifies a problem through examination and deliberation, interprets evidence for different viewpoints, and articulates a resolution based on evidence",2,"Progressing: Clearly identifies a problem, but has difficulty in examining the issue. Differentiates verifiable truth and speculation. Presents a resolution, but loosely based on evidence",1,"Beginning: Identifies a problem, but has difficulty in stating it clearly, considers little evidence for different viewpoints, presents a relatively simple means of resolving the problem",0,Unsatisfactory: No attempt to identify a problem
FerrisQNT1,outcome,QNT1 Express information,Quantitative Literacy – QNT1 Express information – Students express information in multiple mathematical forms.  ,QNT1,highest,,FerrisQNT,active,3,4,"Advanced: Students express information symbolically, graphically, numerically, and verbally, and transition easily from one form to another.",3,Proficient: Students express information in three of the four forms listed in the Level 4 description and transition easily among those forms.,2,Progressing: Students express information in two of the four forms listed in the Level 4 description and transition easily between those forms.,1,Beginning: Students express information in one of the four forms,0,Unsatisfactory: Students are unable to express information in any of the four forms listed in the Level 4 description.
FerrisQNT2,outcome,QNT2 Analyze information,Quantitative Literacy – QNT2 Analyze information – Students analyze information presented in multiple mathematical forms.  ,QNT2,highest,,FerrisQNT,active,3,4,"Advanced: Students examine the structure of information presented symbolically, graphically, numerically, and verbally, and explain the concepts methodically and in detail.",3,Proficient: Students examine the structure of information in three of the four forms listed in the Level 4 description and explain the concepts methodically and in detail.,2,Progressing: Students examine the structure of information in two of the four forms listed in the Level 4 description and explain the concepts methodically and in detail.,1,Beginning: of the four forms listed in the Level 4 description and,0,Unsatisfactory: Students are unable to examine the structure of information in the four forms listed in the Level 4 description and cannot explain the concepts methodically or in detail.
FerrisQNT3,outcome,QNT3 Apply approaches,"Quantitative Literacy – QNT3 Apply approaches – Students apply quantitative approaches to solve problems and draw plausible conclusions. Examples of quantitative approaches include: modeling with a function or equation, using a formula, following the steps of a procedure, performing calculations, using trial and error, estimating,",QNT3,highest,,FerrisQNT,active,3,4,Advanced: Students apply three or more quantitative approaches to solve problems and construct compelling arguments for their conclusions.,3,Proficient: Students apply at least two different quantitative approaches to solve problems and construct strong arguments for their conclusions.,2,Progressing: Students apply at least two different quantitative approaches to solve problems but construct only weak arguments for their conclusions.,1,Beginning: Students apply at least one quantitative approach to  their conclusions.,0,Unsatisfactory: Students are unable to apply even one quantitative approach to solve problems.
FerrisQNT4,outcome,QNT4 Evaluate approaches,"Quantitative Literacy – QNT4 Evaluate approaches – Students evaluate approaches to estimation, modeling, and analysis of data, including assumptions, practical consequences, and limitations. ",QNT4,highest,,FerrisQNT,active,3,4,"Advanced: Students review approaches to problem solving, judge the quality of the arguments that support conclusions, and identify the use of at least four different quantitative approaches.",3,"Proficient: Students review approaches to problem solving, judge the quality of the arguments that support conclusions, and identify the use of at least three different quantitative approaches.",2,"Progressing: Students review approaches to problem solving, judge the quality of the arguments that support conclusions, and identify the use of at least two different quantitative approaches.",1,"Beginning: Students review approaches to problem solving, judge the quality of the arguments that support conclusions, and identify the use of at least one quantitative approach.",0,Unsatisfactory: Students review approaches to problem solving but are unable to judge the quality of the arguments that support conclusions or identify the use of even one quantitative approach.
FerrisSSOC1,outcome,SOC1 Self,"Self and Society – SOC1 Self – Students using social science theory and methods will be able to describe conceptions of self, others and social systems. ",SSOC1,highest,,FerrisSSOC,active,3,4,Advanced: ,3,Proficient: ,2,Progressing: ,1,Beginning: ,0,Unsatisfactory: 
FerrisSSOC2,outcome,SOC2 Society,"Self and Society – SOC2 Society – Students using social science theory and methods will be able to evaluate human interactions within relationships, social groups, organizations, communities, and institutions. ",SSOC2,highest,,FerrisSSOC,active,3,4,Advanced: ,3,Proficient: ,2,Progressing: ,1,Beginning: ,0,Unsatisfactory: 
FerrisSSOC3,outcome,SOC3 Social Control and Agency of Individuals,"Self and Society – SOC3 Social Control and Agency of Individuals – Students using social science theory and methods will be able to critically analyze the bidirectional effects of various social contexts on the behavior of individuals, and the effect that individuals have on society.",SSOC3,highest,,FerrisSSOC,active,3,4,Advanced: ,3,Proficient: ,2,Progressing: ,1,Beginning: ,0,Unsatisfactory: 
FerrisSSOC4,outcome,SOC4 Social Science Theory and Methodology,"Self and Society – SOC4 Social Science Theory and Methodology – Students will be able to apply social science theory, methods, and ethics to better understand individuals and society and their interconnections. ",SSOC4,highest,,FerrisSSOC,active,3,4,Advanced: ,3,Proficient: ,2,Progressing: ,1,Beginning: ,0,Unsatisfactory: 
